<?xml version="1.0" encoding="UTF-8"?>
<employee id="1" xmlns:xsi="http://www.w3.org/2001/XMLSchema-instance" xsi:noNamespaceSchemaLocation="new_employee.xsd">
    <position>MANAGER_1CAT</position>
    <experience>JUNIOR_PLUS</experience>
    <department id="1">
        <title>Order department</title>
        <company>
            <name>Delivery Service</name>
        </company>
    </department>
    <personInfo id="1">
        <firstName>Linda</firstName>
        <lastName>Bella</lastName>
        <age>25</age>
        <passport id="1">
            <number>II01055555</number>
        </passport>
        <address id="1">
            <city>Minsk</city>
            <street>Green street</street>
            <house>33</house>
            <flat>32</flat>
            <zipCode>220155</zipCode>
            <country>BELARUS</country>
        </address>
    </personInfo>
    <packages> </packages>
</employee>